{
  "schema_version": 1,
  "issue": "MYL-42",
  "scene": "12-NW-6C-7_8",
  "source_scene_dir": "/path/to/data/Macarons++/12-NW-6C-7_8",
  "assembly_manifest": "/path/to/data/Macarons++/12-NW-6C-7_8/assembly-manifest.json",
  "baseline_config": "/path/to/baseline-config.json",
  "params_config": "/path/to/params.json",
  "calibration_report": "/path/to/calibration.json",
  "output_root": "/path/to/results/myl42_ntile_run",
  "python": "/path/to/magician/bin/python",
  "gpu": 0,
  "run_id": "myl42_ntile_12-nw-6c-7_8",
  "budget_observations": 101,
  "start_grid_index": [11, 9, 5, 1, 3],
  "tile_partition": {
    "axis": 0,
    "boundaries": [75.0],
    "tile_ids": ["12-NW-6C-7", "12-NW-6C-8"]
  },
  "range_gate": {
    "quantile": 0.9,
    "min_points": 1
  },
  "asset_sha256": {
    "12-NW-6C-7_8.obj": "622b0ec4964d7b515e9a918ed1886e4806e77533bd8deee586d57ff24ed174cc",
    "12-NW-6C-7_8.mtl": "eb488470807eafc6c78159706a9c6e24faf6b94c70fd6d82a0e007a7db74f81d",
    "settings.json": "60772063b91b011f7c0766486c54fcae0c31f788ea78378a921f4f6401e216c7",
    "occupied_pose.pt": "5312e325e5c5972e7c7284eb69052821eead74618fa3ae52747742e91b7a738b",
    "assembly-manifest.json": "654490df322a552dee30a35709fa5cf234b010c0b1323b5d920a5b7ddc4111ee"
  }
}
